{
  "schema_version": 1,
  "host_id": "lab-global-primary",
  "kind": "server",
  "platform": {"os": "linux", "family": "debian", "arch": "amd64"},
  "groups": ["managed_linux", "public_service_hosts"],
  "lifecycle": "active",
  "policy_refs": ["aether-primary-paused"],
  "connection_ref": "connection:lab-global-primary",
  "machine_class": "global",
  "services": {"aether": {"fictional_id": "svc-ops-core", "expected_state": "paused", "actual_hint": "stopped"}}
}
